{
  "published_at": "2026-10-15T17:24:38Z",
  "gauge": {
    "yoy_pct": 3.28,
    "as_of": "2026-10-15",
    "coverage_pct": 39.06,
    "prev_yoy_pct": 3.28,
    "prev_as_of": "2026-10-15"
  },
  "tracker": {
    "yoy_pct": 3.84,
    "as_of": "2026-10-15",
    "coverage_pct": 2.98,
    "prev_yoy_pct": 3.84,
    "prev_as_of": "2026-10-15"
  },
  "official": {
    "yoy_pct": 3.74,
    "prev_yoy_pct": 3.4,
    "month": "2026-09-01",
    "latest_month": "2026-09-01",
    "prev_month": "2026-08-01"
  },
  "gap_pp": -0.46,
  "tracker_gap_pp": 0.1,
  "next_print": {
    "date": "2026-11-10",
    "reference_month": "2026-10"
  }
}
